{
  "schema": 1,
  "robot_id": "arm_left",
  "session": "9f1c7a0e-4a1b-4b2c-8d1e-0f1a2b3c4d5e",
  "instance": "robotpc:4123",
  "seq": 0,
  "ts": 1760356800000,
  "uptime_s": 0.5,
  "ha_clock_offset_ms": null,
  "counters": {
    "accepted": 0,
    "rejected": 0,
    "duplicates": 0,
    "dropped_retained": 0,
    "dropped_oversize": 0,
    "dropped_invalid_id": 0,
    "dropped_queue_full": 0,
    "publish_errors": 0,
    "takeovers": 0
  }
}
